{
  "bundle_version": "0.1",
  "controls": [
    {
      "control_id": "CTRL-COORD-IDENTITY",
      "description": "Signed messages, nonce tracking, epoch binding.",
      "name": "Signed coordination and replay protection",
      "source": "security_suite"
    },
    {
      "control_id": "CTRL-DETECTOR-ADVISOR",
      "description": "Detect + policy-validated containment (TaskH INJ-COMMS-POISON-001).",
      "name": "LLM detector throttle advisor",
      "source": "security_suite"
    },
    {
      "control_id": "CTRL-LLM-SHIELD",
      "description": "RBAC + schema-constrained action_type; prompt-injection resistance.",
      "name": "LLM shield and constrained decoding",
      "source": "security_suite"
    },
    {
      "control_id": "CTRL-MEMORY",
      "description": "Authenticated writes, schema, TTL, poison/override filtering on retrieval.",
      "name": "Memory hardening and poison filtering",
      "source": "security_suite"
    },
    {
      "control_id": "CTRL-OBSERVABILITY",
      "description": "Episode log, hashchain, invariant trace, receipt export.",
      "name": "Observability and forensic freeze",
      "source": "security_suite"
    },
    {
      "control_id": "CTRL-RBAC",
      "description": "Tool and action gating by role; token enforcement.",
      "name": "Role-based access control",
      "source": "security_suite"
    },
    {
      "control_id": "CTRL-TOOL-SANDBOX",
      "description": "Byte/record caps, egress allowlist, data classification.",
      "name": "Tool sandbox and egress limits",
      "source": "security_suite"
    },
    {
      "control_id": "Coordination security pack (scale x method x injection matrix)",
      "name": "Coordination security pack (scale x method x injection matrix)",
      "source": "safety_case"
    },
    {
      "control_id": "Golden runner validates contract",
      "name": "Golden runner validates contract",
      "source": "safety_case"
    },
    {
      "control_id": "No ambient randomness in step",
      "name": "No ambient randomness in step",
      "source": "safety_case"
    },
    {
      "control_id": "Runner output schema enforcement",
      "name": "Runner output schema enforcement",
      "source": "safety_case"
    },
    {
      "control_id": "Single RNG wrapper seeded per episode",
      "name": "Single RNG wrapper seeded per episode",
      "source": "safety_case"
    },
    {
      "control_id": "failure_models.v0.1 maintenance_schedule",
      "name": "failure_models.v0.1 maintenance_schedule",
      "source": "safety_case"
    },
    {
      "control_id": "package-release paper_v0.1 pipeline",
      "name": "package-release paper_v0.1 pipeline",
      "source": "safety_case"
    },
    {
      "control_id": "reagent_policy.v0.1 panel_requirements",
      "name": "reagent_policy.v0.1 panel_requirements",
      "source": "safety_case"
    },
    {
      "control_id": "validate-policy before release",
      "name": "validate-policy before release",
      "source": "safety_case"
    }
  ],
  "evidence": [
    {
      "artifacts": [
        {
          "path": "coord_pack/pack_summary.csv"
        }
      ],
      "evidence_id": "ev-coord-pack-summary-0",
      "evidence_strength": "high",
      "label": "Coordination pack summary",
      "path": "coord_pack/pack_summary.csv",
      "status": "present",
      "summary": {
        "row_count": 24
      },
      "type": "coordination_pack"
    },
    {
      "artifacts": [
        {
          "path": "coord_pack/SECURITY/coordination_risk_matrix.csv"
        }
      ],
      "evidence_id": "ev-coord-risk-matrix-1",
      "evidence_strength": "high",
      "label": "Coordination risk matrix (method x injection x phase)",
      "path": "coord_pack/SECURITY/coordination_risk_matrix.csv",
      "status": "present",
      "type": "security_suite"
    },
    {
      "artifacts": [
        {
          "path": "coord_pack/LAB_COORDINATION_REPORT.md"
        }
      ],
      "evidence_id": "ev-lab-coord-report-2",
      "evidence_strength": "medium",
      "label": "Lab coordination report",
      "path": "coord_pack/LAB_COORDINATION_REPORT.md",
      "status": "present",
      "type": "other"
    },
    {
      "artifacts": [
        {
          "path": "coord_pack/COORDINATION_DECISION.v0.1.json"
        }
      ],
      "evidence_id": "ev-coord-decision-3",
      "evidence_strength": "medium",
      "label": "Coordination decision (method per scale)",
      "path": "coord_pack/COORDINATION_DECISION.v0.1.json",
      "status": "present",
      "summary": {
        "scale_decisions": [
          {
            "chosen_method_id": "kernel_auction_whca_shielded",
            "scale_id": "small_smoke"
          }
        ]
      },
      "type": "coordination_study"
    },
    {
      "artifacts": [
        {
          "path": "full/SECURITY/attack_results.json"
        }
      ],
      "evidence_id": "ev-security-4",
      "evidence_strength": "high",
      "label": "Security attack results",
      "path": "full/SECURITY/attack_results.json",
      "status": "present",
      "summary": {
        "failed": 0,
        "passed": 28,
        "total": 28
      },
      "type": "security_suite"
    },
    {
      "artifacts": [
        {
          "path": "full/SECURITY/coverage.json"
        }
      ],
      "evidence_id": "ev-coverage-5",
      "evidence_strength": "high",
      "label": "Security coverage",
      "path": "full/SECURITY/coverage.json",
      "status": "present",
      "type": "security_suite"
    },
    {
      "artifacts": [
        {
          "path": "full/SAFETY_CASE/safety_case.json"
        }
      ],
      "evidence_id": "ev-safety-case-6",
      "evidence_strength": "high",
      "label": "Safety case claims",
      "path": "full/SAFETY_CASE/safety_case.json",
      "status": "present",
      "type": "safety_case"
    },
    {
      "evidence_id": "ev-missing-R-TOOL-003",
      "expected_sources": [
        "security suite smoke"
      ],
      "label": "Evidence gap: R-TOOL-003",
      "path": "",
      "risk_ids": [
        "R-TOOL-003"
      ],
      "status": "missing",
      "type": "other"
    }
  ],
  "evidence_level": "deterministic_only",
  "git_commit_hash": "3bdc04ada72f78b46fbd7235cf8414b01cd88c98",
  "injection_registry": [
    {
      "expected_effects": "active",
      "injection_id": "INJ-BID-SPOOF-001",
      "reason": "",
      "status": "implemented"
    },
    {
      "expected_effects": "active",
      "injection_id": "INJ-BLAME-SHIFT-001",
      "reason": "",
      "status": "implemented"
    },
    {
      "expected_effects": "active",
      "injection_id": "INJ-CLOCK-SKEW-001",
      "reason": "",
      "status": "implemented"
    },
    {
      "expected_effects": "active",
      "injection_id": "INJ-COLLUSION-001",
      "reason": "",
      "status": "implemented"
    },
    {
      "expected_effects": "active",
      "injection_id": "INJ-COLLUSION-MARKET-001",
      "reason": "",
      "status": "implemented"
    },
    {
      "expected_effects": "active",
      "injection_id": "INJ-COMMS-DELAY-001",
      "reason": "",
      "status": "implemented"
    },
    {
      "expected_effects": "active",
      "injection_id": "INJ-COMMS-DROP-001",
      "reason": "",
      "status": "implemented"
    },
    {
      "expected_effects": "active",
      "injection_id": "INJ-COMMS-FLOOD-LLM-001",
      "reason": "",
      "status": "implemented"
    },
    {
      "expected_effects": "active",
      "injection_id": "INJ-COMMS-POISON-001",
      "reason": "",
      "status": "implemented"
    },
    {
      "expected_effects": "active",
      "injection_id": "INJ-COMMS-REORDER-001",
      "reason": "",
      "status": "implemented"
    },
    {
      "expected_effects": "active",
      "injection_id": "INJ-CONSENSUS-POISON-001",
      "reason": "",
      "status": "implemented"
    },
    {
      "expected_effects": "active",
      "injection_id": "INJ-COORD-BID-SHILL-001",
      "reason": "",
      "status": "implemented"
    },
    {
      "expected_effects": "active",
      "injection_id": "INJ-COORD-PLAN-REPLAY-001",
      "reason": "",
      "status": "implemented"
    },
    {
      "expected_effects": "active",
      "injection_id": "INJ-COORD-PROMPT-INJECT-001",
      "reason": "",
      "status": "implemented"
    },
    {
      "expected_effects": "active",
      "injection_id": "INJ-DOS-PLANNER-001",
      "reason": "",
      "status": "implemented"
    },
    {
      "expected_effects": "active",
      "injection_id": "INJ-ID-REPLAY-COORD-001",
      "reason": "",
      "status": "implemented"
    },
    {
      "expected_effects": "active",
      "injection_id": "INJ-ID-SPOOF-001",
      "reason": "",
      "status": "implemented"
    },
    {
      "expected_effects": "active",
      "injection_id": "INJ-LLM-PROMPT-INJECT-COORD-001",
      "reason": "",
      "status": "implemented"
    },
    {
      "expected_effects": "active",
      "injection_id": "INJ-LLM-TOOL-ESCALATION-001",
      "reason": "",
      "status": "implemented"
    },
    {
      "expected_effects": "active",
      "injection_id": "INJ-MEMORY-POISON-001",
      "reason": "",
      "status": "implemented"
    },
    {
      "expected_effects": "active",
      "injection_id": "INJ-MEMORY-POISON-COORD-001",
      "reason": "",
      "status": "implemented"
    },
    {
      "expected_effects": "active",
      "injection_id": "INJ-NET-DROP-SPIKE-001",
      "reason": "",
      "status": "implemented"
    },
    {
      "expected_effects": "active",
      "injection_id": "INJ-NET-PARTITION-001",
      "reason": "",
      "status": "implemented"
    },
    {
      "expected_effects": "active",
      "injection_id": "INJ-NET-REORDER-001",
      "reason": "",
      "status": "implemented"
    },
    {
      "expected_effects": "active",
      "injection_id": "INJ-PARTIAL-OBS-001",
      "reason": "",
      "status": "implemented"
    },
    {